{
  "name": "ScreenMonitor",
  "slug": "inkbytefo__screenmonitormcp",
  "description": "A REVOLUTIONARY Model Context Protocol (MCP) server! Gives AI real-time vision capabilities and enhanced UI intelligence power. This isn't just screen capture - it gives AI the power to truly \"see\" and understand your digital world!",
  "category": null,
  "qualityScore": 69,
  "githubUrl": "https://github.com/inkbytefo/screenmonitormcp",
  "programmingLanguage": "Python",
  "gitHubOrg": "inkbytefo",
  "gitHubRepo": "screenmonitormcp",
  "repositoryPath": null,
  "gh_stars": 44,
  "gh_contributors": 3,
  "gh_issues": 0,
  "gh_releases": true,
  "gh_ci_cd": false,
  "gh_latest_commit_hash": "f1c166183929f5ff22ae2a18031bab63ef6b3537",
  "last_scraped_at": "2025-08-01T15:33:25.921Z",
  "implementing_tools": null,
  "implementing_prompts": null,
  "implementing_resources": null,
  "implementing_sampling": null,
  "implementing_roots": null,
  "implementing_logging": null,
  "implementing_stdio": null,
  "implementing_streamable_http": null,
  "implementing_oauth2": null,
  "readme": "# ScreenMonitorMCP v2\n\n[![Verified on MseeP](https://mseep.ai/badge.svg)](https://mseep.ai/app/a2dbda0f-f46d-40e1-9c13-0b47eff9df3a)\n[![MseeP.ai Security Assessment Badge](https://mseep.net/pr/inkbytefo-screenmonitormcp-badge.png)](https://mseep.ai/app/inkbytefo-screenmonitormcp)\nA powerful Model Context Protocol (MCP) server that gives AI real-time vision capabilities and enhanced UI intelligence. Transform your AI assistant into a visual powerhouse that can see, analyze, and interact with your screen content.\n\n## What is ScreenMonitorMCP?\n\nScreenMonitorMCP v2 is a revolutionary MCP server that bridges the gap between AI and visual computing. It enables AI assistants to capture screenshots, analyze screen content, and provide intelligent insights about what's happening on your display.\n\n## Key Features\n\n- **Real-time Screen Capture**: Instant screenshot capabilities across multiple monitors\n- **AI-Powered Analysis**: Advanced screen content analysis using state-of-the-art vision models\n- **Streaming Support**: Live screen streaming for continuous monitoring\n- **Performance Monitoring**: Built-in system health and performance metrics\n- **Multi-Platform**: Works seamlessly on Windows, macOS, and Linux\n- **Easy Integration**: Simple setup with Claude Desktop and other MCP clients\n\n## Quick Start\n\n### Installation\n\n```bash\n# Install from PyPI\npip install screenmonitormcp\n\n# Or install from source\ngit clone https://github.com/inkbytefo/screenmonitormcp.git\ncd screenmonitormcp\npip install -e .\n```\n\n### Configuration\n\n1. Create a `.env` file with your AI service credentials:\n\n```env\nOPENAI_API_KEY=your-api-key-here\nOPENAI_MODEL=gpt-4o\n```\n\n2. Add to your Claude Desktop config:\n\n```json\n{\n  \"mcpServers\": {\n    \"screenmonitormcp-v2\": {\n      \"command\": \"python\",\n      \"args\": [\"-m\", \"screenmonitormcp_v2.mcp_main\"],\n      \"env\": {\n        \"OPENAI_API_KEY\": \"your-openai-api-key-here\",\n        \"OPENAI_BASE_URL\": \"https://openrouter.ai/api/v1\",\n        \"OPENAI_MODEL\": \"qwen/qwen2.5-vl-32b-instruct:free\"\n      }\n    }\n  }\n}\n```\n\n3. Restart Claude Desktop and start capturing!\n\n## Available Tools\n\n- `capture_screen` - Take screenshots of any monitor\n- `analyze_screen` - AI-powered screen content analysis\n- `analyze_image` - Analyze any image with AI vision\n- `create_stream` - Start live screen streaming\n- `get_performance_metrics` - System health monitoring\n\n## Use Cases\n\n- **UI/UX Analysis**: Get AI insights on interface design and usability\n- **Debugging Assistance**: Visual debugging with AI-powered error detection\n- **Content Creation**: Automated screenshot documentation and analysis\n- **Accessibility Testing**: Screen reader and accessibility compliance checking\n- **System Monitoring**: Visual system health and performance tracking\n\n## Documentation\n\nFor detailed setup instructions and advanced configuration, see our [MCP Setup Guide](MCP_SETUP_GUIDE.md).\n\n## Requirements\n\n- Python 3.8+\n- OpenAI API key (or compatible service)\n- MCP-compatible client (Claude Desktop, etc.)\n\n## Contributing\n\nWe welcome contributions! Please see [CONTRIBUTING.md](CONTRIBUTING.md) for guidelines.\n\n## License\n\nMIT License - see [LICENSE](LICENSE) for details.\n\n## Previous Version\n\nLooking for v1? Check the [v1 branch](https://github.com/inkbytefo/ScreenMonitorMCP/tree/v1) for the previous version.\n\n---\n\n**Built with ❤️ by [inkbytefo](https://github.com/inkbytefo)**\n"
}