{
  "name": "openai",
  "slug": "pierrebrunelle__mcp-server-openai",
  "description": "Query OpenAI models directly from Claude using MCP protocol.",
  "category": null,
  "qualityScore": 64,
  "githubUrl": "https://github.com/pierrebrunelle/mcp-server-openai",
  "programmingLanguage": "Python",
  "gitHubOrg": "pierrebrunelle",
  "gitHubRepo": "mcp-server-openai",
  "repositoryPath": null,
  "gh_stars": 71,
  "gh_contributors": 1,
  "gh_issues": 2,
  "gh_releases": false,
  "gh_ci_cd": false,
  "gh_latest_commit_hash": "67e598884e6fe7f28fc43bec2db8e37f482953ee",
  "last_scraped_at": "2025-08-01T15:33:24.844Z",
  "implementing_tools": null,
  "implementing_prompts": null,
  "implementing_resources": null,
  "implementing_sampling": null,
  "implementing_roots": null,
  "implementing_logging": null,
  "implementing_stdio": null,
  "implementing_streamable_http": null,
  "implementing_oauth2": null,
  "readme": "# OpenAI MCP Server\r\n\r\nQuery OpenAI models directly from Claude using MCP protocol.\r\n\r\n![preview](preview.png)\r\n\r\n## Setup\r\n\r\nAdd to `claude_desktop_config.json`:\r\n\r\n```json\r\n{\r\n  \"mcpServers\": {\r\n    \"openai-server\": {\r\n      \"command\": \"python\",\r\n      \"args\": [\"-m\", \"src.mcp_server_openai.server\"],\r\n      \"env\": {\r\n        \"PYTHONPATH\": \"C:/path/to/your/mcp-server-openai\",\r\n        \"OPENAI_API_KEY\": \"your-key-here\"\r\n      }\r\n    }\r\n  }\r\n}\r\n```\r\n\r\n## Development\r\n```bash\r\ngit clone https://github.com/pierrebrunelle/mcp-server-openai\r\ncd mcp-server-openai\r\npip install -e .\r\n```\r\n\r\n## Testing\r\n```python\r\n# Run tests from project root\r\npytest -v test_openai.py -s\r\n\r\n# Sample test output:\r\nTesting OpenAI API call...\r\nOpenAI Response: Hello! I'm doing well, thank you for asking...\r\nPASSED\r\n```\r\n\r\n## License\r\nMIT License\r\n"
}