{
  "name": "monitor",
  "slug": "seekrays__mcp-monitor",
  "description": "A system monitoring tool that exposes system metrics via the Model Context Protocol (MCP). This tool allows LLMs to retrieve real-time system information through an MCP-compatible interface.",
  "readme": "# MCP System Monitor\n\n[![Discord](https://img.shields.io/badge/Discord-Join%20Chat-blue?style=flat&logo=discord)](https://discord.gg/kbMJ9Qpf)\n\nA system monitoring tool that exposes system metrics via the Model Context Protocol (MCP). This tool allows LLMs to retrieve real-time system information through an MCP-compatible interface.\n\n![](./doc/snapshot-1.png)\n\n## Features\n\nThis tool provides the following monitoring capabilities:\n\n- **CPU Information**: Usage percentage, core count, and detailed CPU info\n- **Memory Information**: Virtual and swap memory usage\n- **Disk Information**: Disk usage, partitions, and I/O statistics\n- **Network Information**: Network interfaces, connections, and traffic statistics\n- **Host Information**: System details, uptime, boot time, and users\n- **Process Information**: Process listing, sorting, and detailed per-process statistics\n\n\n## Available Tools\n\n### 1. CPU Information\n\n```\nTool: get_cpu_info\nDescription: Get CPU information and usage\nParameters:\n  - per_cpu (boolean, default: false): Whether to return data for each core\n```\n\n### 2. Memory Information\n\n```\nTool: get_memory_info\nDescription: Get system memory usage information\nParameters: None\n```\n\n### 3. Disk Information\n\n```\nTool: get_disk_info\nDescription: Get disk usage information\nParameters:\n  - path (string, default: \"/\"): Specify the disk path to query\n  - all_partitions (boolean, default: false): Whether to return information for all partitions\n```\n\n### 4. Network Information\n\n```\nTool: get_network_info\nDescription: Get network interface and traffic information\nParameters:\n  - interface (string, optional): Specify the network interface name to query\n```\n\n### 5. Host Information\n\n```\nTool: get_host_info\nDescription: Get host system information\nParameters: None\n```\n\n### 6. Process Information\n\n```\nTool: get_process_info\nDescription: Get process information\nParameters:\n  - pid (number, optional): Process ID to get detailed information for a specific process\n  - limit (number, default: 10): Limit the number of processes returned\n  - sort_by (string, default: \"cpu\"): Sort field (cpu, memory, pid, name)\n```\n\n\n## Installation\n\n```bash\ngit clone https://github.com/seekrays/mcp-monitor.git\ncd mcp-monitor\nmake build\n```\n\n## Usage\n\nRun the compiled binary:\n\n```bash\n./mcp-monitor\n```\n\nThe server starts in stdio mode, ready to communicate with an MCP-compatible LLM client.\n\n\n## Contributing\n\nContributions are welcome! Please feel free to submit a Pull Request. ",
  "category": null,
  "qualityScore": 79,
  "githubUrl": "https://github.com/seekrays/mcp-monitor",
  "programmingLanguage": "Go",
  "gitHubOrg": "seekrays",
  "gitHubRepo": "mcp-monitor",
  "repositoryPath": null,
  "gh_stars": 54,
  "gh_contributors": 2,
  "gh_issues": 0,
  "gh_releases": true,
  "gh_ci_cd": false,
  "gh_latest_commit_hash": "93cb57d6bf0765792252d1646e75bb2e4554ae5e",
  "last_scraped_at": "2025-07-31T20:48:53.824Z",
  "implementing_tools": null,
  "implementing_prompts": null,
  "implementing_resources": null,
  "implementing_sampling": null,
  "implementing_roots": null,
  "implementing_logging": null,
  "implementing_stdio": null,
  "implementing_streamable_http": null,
  "implementing_oauth2": null
}